mysql> show databases;
+--------------------+
| Database           |
+--------------------+
| exam               |
| exam1              |
| exampledb          |
| information_schema |
| jsp                |
| mysql              |
| pandeyji_eatery    |
| performance_schema |
| project1           |
| servlet            |
| sys                |
+--------------------+
11 rows in set (0.04 sec)

mysql> create database knowitdb;
Query OK, 1 row affected (0.04 sec)

mysql> use knowitdb;
Database changed
mysql> CREATE TABLE EMP
    ->        (EMPNO INT,
    ->         ENAME varchar(15),
    ->         JOB varchar(9),
    ->         MGR INT,
    ->         HIREDATE DATE,
    ->         SAL DECIMAL(7,2),
    ->         COMM DECIMAL(7,2),
    ->         DEPTNO INT);
Query OK, 0 rows affected (0.03 sec)


mysql> INSERT INTO EMP VALUES
    ->         (7499, 'ALLEN',  'SALESMAN',  7698,
    ->         STR_TO_DATE('20-FEB-1981', '%d-%b-%Y'), 1600,  300, 30);
Query OK, 1 row affected (0.01 sec)

mysql> INSERT INTO EMP VALUES
    ->         (7521, 'WARD',   'SALESMAN',  7698,
    ->         STR_TO_DATE('22-FEB-1981', '%d-%b-%Y'), 1250,  500, 30);
Query OK, 1 row affected (0.00 sec)

mysql> INSERT INTO EMP VALUES
    ->         (7566, 'JONES',  'MANAGER',   7839,
    ->         STR_TO_DATE('2-APR-1981', '%d-%b-%Y'),  2975, NULL, 20);
Query OK, 1 row affected (0.00 sec)

mysql> INSERT INTO EMP VALUES
    ->         (7654, 'MARTIN', 'SALESMAN',  7698,
    ->         STR_TO_DATE('28-SEP-1981', '%d-%b-%Y'), 1250, 1400, 30);
Query OK, 1 row affected (0.00 sec)

mysql> INSERT INTO EMP VALUES
    ->         (7698, 'BLAKE',  'MANAGER',   7839,
    ->         STR_TO_DATE('1-MAY-1981', '%d-%b-%Y'),  2850, NULL, 30);
Query OK, 1 row affected (0.00 sec)

mysql> INSERT INTO EMP VALUES
    ->         (7782, 'CLARK',  'MANAGER',   7839,
    ->         STR_TO_DATE('9-JUN-1981', '%d-%b-%Y'),  2450, NULL, 10);
Query OK, 1 row affected (0.00 sec)

mysql> INSERT INTO EMP VALUES
    ->         (7788, 'SCOTT',  'ANALYST',   7566,
    ->         STR_TO_DATE('09-DEC-1982', '%d-%b-%Y'), 3000, NULL, 20);
Query OK, 1 row affected (0.00 sec)

mysql> INSERT INTO EMP VALUES
    ->         (7839, 'KING',   'PRESIDENT', NULL,
    ->         STR_TO_DATE('17-NOV-1981', '%d-%b-%Y'), 5000, NULL, 10);
Query OK, 1 row affected (0.00 sec)

mysql> INSERT INTO EMP VALUES
    ->         (7844, 'TURNER', 'SALESMAN',  7698,
    ->         STR_TO_DATE('8-SEP-1981', '%d-%b-%Y'),  1500,    0, 30);
Query OK, 1 row affected (0.01 sec)

mysql> INSERT INTO EMP VALUES
    ->         (7876, 'ADAMS',  'CLERK',     7788,
    ->         STR_TO_DATE('12-JAN-1983', '%d-%b-%Y'), 1100, NULL, 20);
Query OK, 1 row affected (0.00 sec)

mysql> INSERT INTO EMP VALUES
    ->         (7900, 'JAMES',  'CLERK',     7698,
    ->         STR_TO_DATE('3-DEC-1981', '%d-%b-%Y'),   950, NULL, 30);
Query OK, 1 row affected (0.00 sec)

mysql> INSERT INTO EMP VALUES
    ->         (7902, 'FORD',   'ANALYST',   7566,
    ->         STR_TO_DATE('3-DEC-1981', '%d-%b-%Y'),  3000, NULL, 20);
Query OK, 1 row affected (0.00 sec)

mysql> INSERT INTO EMP VALUES
    ->         (7934, 'MILLER', 'CLERK',     7782,
    ->         STR_TO_DATE('23-JAN-1982', '%d-%b-%Y'), 1300, NULL, 10);
Query OK, 1 row affected (0.00 sec)

mysql>
mysql> CREATE TABLE DEPT
    ->        (DEPTNO INT,
    ->         DNAME varchar(14),
    ->         LOC varchar(13) );
Query OK, 0 rows affected (0.01 sec)

mysql>
mysql> INSERT INTO DEPT VALUES (10, 'ACCOUNTING', 'NEW YORK');
Query OK, 1 row affected (0.00 sec)

mysql> INSERT INTO DEPT VALUES (20, 'RESEARCH',   'DALLAS');
Query OK, 1 row affected (0.00 sec)

mysql> INSERT INTO DEPT VALUES (30, 'SALES',      'CHICAGO');
Query OK, 1 row affected (0.00 sec)

mysql> INSERT INTO DEPT VALUES (40, 'OPERATIONS', 'BOSTON');
Query OK, 1 row affected (0.00 sec)

mysql>
mysql> CREATE TABLE BONUS
    ->         (ENAME varchar(10),
    ->          JOB   varchar(9),
    ->          SAL   INT,
    ->          COMM  INT);
Query OK, 0 rows affected (0.01 sec)

mysql>
mysql> CREATE TABLE SALGRADE
    ->         (GRADE INT,
    ->          LOSAL INT,
    ->          HISAL INT);
Query OK, 0 rows affected (0.01 sec)

mysql>
mysql> INSERT INTO SALGRADE VALUES (1,  700, 1200);
Query OK, 1 row affected (0.00 sec)

mysql> INSERT INTO SALGRADE VALUES (2, 1201, 1400);
Query OK, 1 row affected (0.00 sec)

mysql> INSERT INTO SALGRADE VALUES (3, 1401, 2000);
Query OK, 1 row affected (0.00 sec)

mysql> INSERT INTO SALGRADE VALUES (4, 2001, 3000);
Query OK, 1 row affected (0.00 sec)

mysql> INSERT INTO SALGRADE VALUES (5, 3001, 9999);
Query OK, 1 row affected (0.00 sec)

mysql>
mysql> CREATE TABLE DUMMY
    ->         (DUMMY INT);
Query OK, 0 rows affected (0.01 sec)

mysql>
mysql> INSERT INTO DUMMY VALUES (0);
Query OK, 1 row affected (0.00 sec)

mysql>
mysql> COMMIT;
Query OK, 0 rows affected (0.00 sec)

mysql>
mysql> SET TERMOUT ON
    -> PROMPT Demonstration table build is complete.
    ->
    -> EXIT;
ERROR 1064 (42000): You have an error in your SQL syntax; check the manual that corresponds to your MySQL server version for the right syntax to use near 'ON
PROMPT Demonstration table build is complete.

EXIT' at line 1
mysql> show tables;
+--------------------+
| Tables_in_knowitdb |
+--------------------+
| bonus              |
| dept               |
| dummy              |
| emp                |
| salgrade           |
+--------------------+
5 rows in set (0.04 sec)

mysql> create table Vehicle
    -> (vid int, vname varchar(20),price int ,discount int,milage int,details varchar(20));
Query OK, 0 rows affected (0.05 sec)


mysql> insert into Vehicle values(1,"Activa",80000,10,35,"Two wheeler.Sturdy");
Query OK, 1 row affected (0.05 sec)

mysql> select * from Vehicle;
+------+--------+-------+----------+--------+--------------------+
| vid  | vname  | price | discount | milage | details            |
+------+--------+-------+----------+--------+--------------------+
|    1 | Activa | 80000 |       10 |     35 | Two wheeler.Sturdy |
+------+--------+-------+----------+--------+--------------------+
1 row in set (0.00 sec)



mysql> insert into Vehicle values(2,"Santro",95000,20,20,"Product of Hyandai");
Query OK, 1 row affected (0.00 sec)

mysql> insert into Vehicle values(3,"Yamaha",160000,5,70,"Sturdy and good");
Query OK, 1 row affected (0.03 sec)

mysql> insert into Vehicle values(4,"i-10",300000,8,18,"Good small car");
Query OK, 1 row affected (0.04 sec)

mysql> insert into Vehicle values(5,"WaganR",250000,10,25,"Good milage car");
Query OK, 1 row affected (0.06 sec)

mysql> insert into Vehicle values(6,"Hero Splendor",75000,9,65,"Best bike");
Query OK, 1 row affected (0.05 sec)

mysql> insert into Vehicle values(7,"Royal Enfield",190000,5,40,"a royal bike");
Query OK, 1 row affected (0.04 sec)

mysql> select * from Vehicle;
+------+---------------+--------+----------+--------+--------------------+
| vid  | vname         | price  | discount | milage | details            |
+------+---------------+--------+----------+--------+--------------------+
|    1 | Activa        |  80000 |       10 |     35 | Two wheeler.Sturdy |
|    2 | Santro        |  95000 |       20 |     20 | Product of Hyandai |
|    3 | Yamaha        | 160000 |        5 |     70 | Sturdy and good    |
|    4 | i-10          | 300000 |        8 |     18 | Good small car     |
|    5 | WaganR        | 250000 |       10 |     25 | Good milage car    |
|    6 | Hero Splendor |  75000 |        9 |     65 | Best bike          |
|    7 | Royal Enfield | 190000 |        5 |     40 | a royal bike       |
+------+---------------+--------+----------+--------+--------------------+
7 rows in set (0.00 sec)

mysql> create table Customer
    -> (custid int,cname varchar(10),location varchar(10));
Query OK, 0 rows affected (0.03 sec)

mysql> insert into Customer values
    -> (1,"Nilima","Pimpri"),
    -> (2,"Ganesh","Pune"),
    -> (3,"Kishor","Kothrud"),
    -> (4,"Priya","Aundh");
Query OK, 4 rows affected (0.01 sec)
Records: 4  Duplicates: 0  Warnings: 0

mysql> select * from Customer;
+--------+--------+----------+
| custid | cname  | location |
+--------+--------+----------+
|      1 | Nilima | Pimpri   |
|      2 | Ganesh | Pune     |
|      3 | Kishor | Kothrud  |
|      4 | Priya  | Aundh    |
+--------+--------+----------+
4 rows in set (0.00 sec)

mysql> create table Salesman
    -> (sid int,sname varchar(10),city varchar(10),experience int);
Query OK, 0 rows affected (0.07 sec)

mysql> insert into Salesman values
    -> (10,"Rajesh","mumbai",5),
    -> (11,"Seema","Pune",8),
    -> (12,"Shailesh","Nagpur",7),
    -> (13,"Rakhi","Pune",2);
Query OK, 4 rows affected (0.05 sec)
Records: 4  Duplicates: 0  Warnings: 0

mysql> select * from Salesman;
+------+----------+--------+------------+
| sid  | sname    | city   | experience |
+------+----------+--------+------------+
|   10 | Rajesh   | mumbai |          5 |
|   11 | Seema    | Pune   |          8 |
|   12 | Shailesh | Nagpur |          7 |
|   13 | Rakhi    | Pune   |          2 |
+------+----------+--------+------------+
4 rows in set (0.00 sec)

mysql> select vid,vname,price from Vehicle;
+------+---------------+--------+
| vid  | vname         | price  |
+------+---------------+--------+
|    1 | Activa        |  80000 |
|    2 | Santro        |  95000 |
|    3 | Yamaha        | 160000 |
|    4 | i-10          | 300000 |
|    5 | WaganR        | 250000 |
|    6 | Hero Splendor |  75000 |
|    7 | Royal Enfield | 190000 |
+------+---------------+--------+
7 rows in set (0.00 sec)

mysql> select vid,vname,price,details from Vehicle;
+------+---------------+--------+--------------------+
| vid  | vname         | price  | details            |
+------+---------------+--------+--------------------+
|    1 | Activa        |  80000 | Two wheeler.Sturdy |
|    2 | Santro        |  95000 | Product of Hyandai |
|    3 | Yamaha        | 160000 | Sturdy and good    |
|    4 | i-10          | 300000 | Good small car     |
|    5 | WaganR        | 250000 | Good milage car    |
|    6 | Hero Splendor |  75000 | Best bike          |
|    7 | Royal Enfield | 190000 | a royal bike       |
+------+---------------+--------+--------------------+
7 rows in set (0.00 sec)


mysql> select * from Salesman;
+------+----------+--------+------------+
| sid  | sname    | city   | experience |
+------+----------+--------+------------+
|   10 | Rajesh   | mumbai |          5 |
|   11 | Seema    | Pune   |          8 |
|   12 | Shailesh | Nagpur |          7 |
|   13 | Rakhi    | Pune   |          2 |
+------+----------+--------+------------+
4 rows in set (0.00 sec)

mysql> select sname from Salesman where city="Pune";
+-------+
| sname |
+-------+
| Seema |
| Rakhi |
+-------+
2 rows in set (0.00 sec)

mysql> select * from Customer;
+--------+--------+----------+
| custid | cname  | location |
+--------+--------+----------+
|      1 | Nilima | Pimpri   |
|      2 | Ganesh | Pune     |
|      3 | Kishor | Kothrud  |
|      4 | Priya  | Aundh    |
+--------+--------+----------+
4 rows in set (0.00 sec)

mysql> insert into Customer values
    -> (5,"Geeta","Pimpri"),
    -> (6,"Raj","Aundh"),
    -> (7,"Yash","Aundh");
Query OK, 3 rows affected (0.01 sec)
Records: 3  Duplicates: 0  Warnings: 0

mysql> select * from Vehicle where vname="Royal Enfield";
+------+---------------+--------+----------+--------+--------------+
| vid  | vname         | price  | discount | milage | details      |
+------+---------------+--------+----------+--------+--------------+
|    7 | Royal Enfield | 190000 |        5 |     40 | a royal bike |
+------+---------------+--------+----------+--------+--------------+
1 row in set (0.00 sec)

mysql> select * from Vehicle where vname in("i-10");
+------+-------+--------+----------+--------+----------------+
| vid  | vname | price  | discount | milage | details        |
+------+-------+--------+----------+--------+----------------+
|    4 | i-10  | 300000 |        8 |     18 | Good small car |
+------+-------+--------+----------+--------+----------------+
1 row in set (0.00 sec)




mysql> select vid,vname,price,details,(price-discount) as Total_Price from Vehicle;
+------+---------------+--------+--------------------+-------------+
| vid  | vname         | price  | details            | Total_Price |
+------+---------------+--------+--------------------+-------------+
|    1 | Activa        |  80000 | Two wheeler.Sturdy |       79990 |
|    2 | Santro        |  95000 | Product of Hyandai |       94980 |
|    3 | Yamaha        | 160000 | Sturdy and good    |      159995 |
|    4 | i-10          | 300000 | Good small car     |      299992 |
|    5 | WaganR        | 250000 | Good milage car    |      249990 |
|    6 | Hero Splendor |  75000 | Best bike          |       74991 |
|    7 | Royal Enfield | 190000 | a royal bike       |      189995 |
+------+---------------+--------+--------------------+-------------+
7 rows in set (0.05 sec)

mysql> select * from Vehicle where price<100000;
+------+---------------+-------+----------+--------+--------------------+
| vid  | vname         | price | discount | milage | details            |
+------+---------------+-------+----------+--------+--------------------+
|    1 | Activa        | 80000 |       10 |     35 | Two wheeler.Sturdy |
|    2 | Santro        | 95000 |       20 |     20 | Product of Hyandai |
|    6 | Hero Splendor | 75000 |        9 |     65 | Best bike          |
+------+---------------+-------+----------+--------+--------------------+
3 rows in set (0.00 sec)

mysql> select * from Salesman where experience>5;
+------+----------+--------+------------+
| sid  | sname    | city   | experience |
+------+----------+--------+------------+
|   11 | Seema    | Pune   |          8 |
|   12 | Shailesh | Nagpur |          7 |
+------+----------+--------+------------+
2 rows in set (0.03 sec)
mysql> create table Employee
    -> (eno int, ename varchar(14),basic int,incentive int);
Query OK, 0 rows affected (0.07 sec)

mysql> insert into employee values
    -> (1,"Rajesh",20000,1500),
    -> (2,"Sarita",25000,1000),
    -> (3,"Meera",15000,3000),
    -> (4,"Jitesh",30000,500),
    -> (5,"Ramesh",12000,3000);
Query OK, 5 rows affected (0.04 sec)
Records: 5  Duplicates: 0  Warnings: 0

mysql> select * from employee;
+------+--------+-------+-----------+
| eno  | ename  | basic | incentive |
+------+--------+-------+-----------+
|    1 | Rajesh | 20000 |      1500 |
|    2 | Sarita | 25000 |      1000 |
|    3 | Meera  | 15000 |      3000 |
|    4 | Jitesh | 30000 |       500 |
|    5 | Ramesh | 12000 |      3000 |
+------+--------+-------+-----------+
5 rows in set (0.00 sec)

mysql> select * from employee where basic>15000;
+------+--------+-------+-----------+
| eno  | ename  | basic | incentive |
+------+--------+-------+-----------+
|    1 | Rajesh | 20000 |      1500 |
|    2 | Sarita | 25000 |      1000 |
|    4 | Jitesh | 30000 |       500 |
+------+--------+-------+-----------+
3 rows in set (0.00 sec)

mysql> select * from employee where basic<15000 and basic >900;
+------+--------+-------+-----------+
| eno  | ename  | basic | incentive |
+------+--------+-------+-----------+
|    5 | Ramesh | 12000 |      3000 |
+------+--------+-------+-----------+
1 row in set (0.00 sec)

mysql> describe vehicle;
+----------+-------------+------+-----+---------+-------+
| Field    | Type        | Null | Key | Default | Extra |
+----------+-------------+------+-----+---------+-------+
| vid      | int         | YES  |     | NULL    |       |
| vname    | varchar(20) | YES  |     | NULL    |       |
| price    | int         | YES  |     | NULL    |       |
| discount | int         | YES  |     | NULL    |       |
| milage   | int         | YES  |     | NULL    |       |
| details  | varchar(20) | YES  |     | NULL    |       |
+----------+-------------+------+-----+---------+-------+
6 rows in set (0.06 sec)

mysql> select * from employee where basic<15000 or basic >900;
+------+--------+-------+-----------+
| eno  | ename  | basic | incentive |
+------+--------+-------+-----------+
|    1 | Rajesh | 20000 |      1500 |
|    2 | Sarita | 25000 |      1000 |
|    3 | Meera  | 15000 |      3000 |
|    4 | Jitesh | 30000 |       500 |
|    5 | Ramesh | 12000 |      3000 |
+------+--------+-------+-----------+
5 rows in set (0.00 sec)

mysql> select * from employee where basic<20000;
+------+--------+-------+-----------+
| eno  | ename  | basic | incentive |
+------+--------+-------+-----------+
|    3 | Meera  | 15000 |      3000 |
|    5 | Ramesh | 12000 |      3000 |
+------+--------+-------+-----------+
2 rows in set (0.00 sec)

mysql> Update employee set basic=basic+(basic*5/100) where basic<20000;
Query OK, 2 rows affected (0.04 sec)
Rows matched: 2  Changed: 2  Warnings: 0

mysql> select * from employee;
+------+--------+-------+-----------+
| eno  | ename  | basic | incentive |
+------+--------+-------+-----------+
|    1 | Rajesh | 20000 |      1500 |
|    2 | Sarita | 25000 |      1000 |
|    3 | Meera  | 15750 |      3000 |
|    4 | Jitesh | 30000 |       500 |
|    5 | Ramesh | 12600 |      3000 |
+------+--------+-------+-----------+
5 rows in set (0.00 sec)

mysql> select * from customer;
+--------+--------+----------+
| custid | cname  | location |
+--------+--------+----------+
|      1 | Nilima | Pimpri   |
|      2 | Ganesh | Pune     |
|      3 | Kishor | Kothrud  |
|      4 | Priya  | Aundh    |
|      5 | Geeta  | Pimpri   |
|      6 | Raj    | Aundh    |
|      7 | Yash   | Aundh    |
+--------+--------+----------+
7 rows in set (0.00 sec)

mysql> Delete from customer where location in(Aundh);
ERROR 1054 (42S22): Unknown column 'Aundh' in 'where clause'
mysql> Delete from customer where location in("Aundh");
Query OK, 3 rows affected (0.03 sec)

mysql> select * from customer;
+--------+--------+----------+
| custid | cname  | location |
+--------+--------+----------+
|      1 | Nilima | Pimpri   |
|      2 | Ganesh | Pune     |
|      3 | Kishor | Kothrud  |
|      5 | Geeta  | Pimpri   |
+--------+--------+----------+
4 rows in set (0.00 sec)

mysql> select * from vehicle;
+------+---------------+--------+----------+--------+--------------------+
| vid  | vname         | price  | discount | milage | details            |
+------+---------------+--------+----------+--------+--------------------+
|    1 | Activa        |  80000 |       10 |     35 | Two wheeler.Sturdy |
|    2 | Santro        |  95000 |       20 |     20 | Product of Hyandai |
|    3 | Yamaha        | 160000 |        5 |     70 | Sturdy and good    |
|    4 | i-10          | 300000 |        8 |     18 | Good small car     |
|    5 | WaganR        | 250000 |       10 |     25 | Good milage car    |
|    6 | Hero Splendor |  75000 |        9 |     65 | Best bike          |
|    7 | Royal Enfield | 190000 |        5 |     40 | a royal bike       |
+------+---------------+--------+----------+--------+--------------------+
7 rows in set (0.00 sec)

mysql> Update vehicle set price=80000 where price=75000;
Query OK, 1 row affected (0.05 sec)
Rows matched: 1  Changed: 1  Warnings: 0

mysql> select *from vehicel;
ERROR 1146 (42S02): Table 'knowitdb.vehicel' doesn't exist
mysql> select *from vehicle;
+------+---------------+--------+----------+--------+--------------------+
| vid  | vname         | price  | discount | milage | details            |
+------+---------------+--------+----------+--------+--------------------+
|    1 | Activa        |  80000 |       10 |     35 | Two wheeler.Sturdy |
|    2 | Santro        |  95000 |       20 |     20 | Product of Hyandai |
|    3 | Yamaha        | 160000 |        5 |     70 | Sturdy and good    |
|    4 | i-10          | 300000 |        8 |     18 | Good small car     |
|    5 | WaganR        | 250000 |       10 |     25 | Good milage car    |
|    6 | Hero Splendor |  80000 |        9 |     65 | Best bike          |
|    7 | Royal Enfield | 190000 |        5 |     40 | a royal bike       |
+------+---------------+--------+----------+--------+--------------------+
7 rows in set (0.00 sec)

mysql> select * from emp;
+-------+--------+-----------+------+------------+---------+---------+--------+
| EMPNO | ENAME  | JOB       | MGR  | HIREDATE   | SAL     | COMM    | DEPTNO |
+-------+--------+-----------+------+------------+---------+---------+--------+
|  7499 | ALLEN  | SALESMAN  | 7698 | 1981-02-20 | 1600.00 |  300.00 |     30 |
|  7521 | WARD   | SALESMAN  | 7698 | 1981-02-22 | 1250.00 |  500.00 |     30 |
|  7566 | JONES  | MANAGER   | 7839 | 1981-04-02 | 2975.00 |    NULL |     20 |
|  7654 | MARTIN | SALESMAN  | 7698 | 1981-09-28 | 1250.00 | 1400.00 |     30 |
|  7698 | BLAKE  | MANAGER   | 7839 | 1981-05-01 | 2850.00 |    NULL |     30 |
|  7782 | CLARK  | MANAGER   | 7839 | 1981-06-09 | 2450.00 |    NULL |     10 |
|  7788 | SCOTT  | ANALYST   | 7566 | 1982-12-09 | 3000.00 |    NULL |     20 |
|  7839 | KING   | PRESIDENT | NULL | 1981-11-17 | 5000.00 |    NULL |     10 |
|  7844 | TURNER | SALESMAN  | 7698 | 1981-09-08 | 1500.00 |    0.00 |     30 |
|  7876 | ADAMS  | CLERK     | 7788 | 1983-01-12 | 1100.00 |    NULL |     20 |
|  7900 | JAMES  | CLERK     | 7698 | 1981-12-03 |  950.00 |    NULL |     30 |
|  7902 | FORD   | ANALYST   | 7566 | 1981-12-03 | 3000.00 |    NULL |     20 |
|  7934 | MILLER | CLERK     | 7782 | 1982-01-23 | 1300.00 |    NULL |     10 |
+-------+--------+-----------+------+------------+---------+---------+--------+
13 rows in set (0.00 sec)

mysql> select * from emp where sal>2000 and comm>200;
Empty set (0.04 sec)

mysql> select * from emp where job="clerk" or sal>2000;
+-------+--------+-----------+------+------------+---------+------+--------+
| EMPNO | ENAME  | JOB       | MGR  | HIREDATE   | SAL     | COMM | DEPTNO |
+-------+--------+-----------+------+------------+---------+------+--------+
|  7566 | JONES  | MANAGER   | 7839 | 1981-04-02 | 2975.00 | NULL |     20 |
|  7698 | BLAKE  | MANAGER   | 7839 | 1981-05-01 | 2850.00 | NULL |     30 |
|  7782 | CLARK  | MANAGER   | 7839 | 1981-06-09 | 2450.00 | NULL |     10 |
|  7788 | SCOTT  | ANALYST   | 7566 | 1982-12-09 | 3000.00 | NULL |     20 |
|  7839 | KING   | PRESIDENT | NULL | 1981-11-17 | 5000.00 | NULL |     10 |
|  7876 | ADAMS  | CLERK     | 7788 | 1983-01-12 | 1100.00 | NULL |     20 |
|  7900 | JAMES  | CLERK     | 7698 | 1981-12-03 |  950.00 | NULL |     30 |
|  7902 | FORD   | ANALYST   | 7566 | 1981-12-03 | 3000.00 | NULL |     20 |
|  7934 | MILLER | CLERK     | 7782 | 1982-01-23 | 1300.00 | NULL |     10 |
+-------+--------+-----------+------+------------+---------+------+--------+
9 rows in set (0.00 sec)

mysql> select * from emp where sal=1250 or sal=1100;
+-------+--------+----------+------+------------+---------+---------+--------+
| EMPNO | ENAME  | JOB      | MGR  | HIREDATE   | SAL     | COMM    | DEPTNO |
+-------+--------+----------+------+------------+---------+---------+--------+
|  7521 | WARD   | SALESMAN | 7698 | 1981-02-22 | 1250.00 |  500.00 |     30 |
|  7654 | MARTIN | SALESMAN | 7698 | 1981-09-28 | 1250.00 | 1400.00 |     30 |
|  7876 | ADAMS  | CLERK    | 7788 | 1983-01-12 | 1100.00 |    NULL |     20 |
+-------+--------+----------+------+------------+---------+---------+--------+
3 rows in set (0.00 sec)

mysql> select * from emp where sal in(1250,1100);
+-------+--------+----------+------+------------+---------+---------+--------+
| EMPNO | ENAME  | JOB      | MGR  | HIREDATE   | SAL     | COMM    | DEPTNO |
+-------+--------+----------+------+------------+---------+---------+--------+
|  7521 | WARD   | SALESMAN | 7698 | 1981-02-22 | 1250.00 |  500.00 |     30 |
|  7654 | MARTIN | SALESMAN | 7698 | 1981-09-28 | 1250.00 | 1400.00 |     30 |
|  7876 | ADAMS  | CLERK    | 7788 | 1983-01-12 | 1100.00 |    NULL |     20 |
+-------+--------+----------+------+------------+---------+---------+--------+
3 rows in set (0.00 sec)

mysql> select * from emp where sal>2000 and sal<2850;
+-------+-------+---------+------+------------+---------+------+--------+
| EMPNO | ENAME | JOB     | MGR  | HIREDATE   | SAL     | COMM | DEPTNO |
+-------+-------+---------+------+------------+---------+------+--------+
|  7782 | CLARK | MANAGER | 7839 | 1981-06-09 | 2450.00 | NULL |     10 |
+-------+-------+---------+------+------------+---------+------+--------+
1 row in set (0.00 sec)

mysql> select ename,sal,deptno from emp where deptno=20;
+-------+---------+--------+
| ename | sal     | deptno |
+-------+---------+--------+
| JONES | 2975.00 |     20 |
| SCOTT | 3000.00 |     20 |
| ADAMS | 1100.00 |     20 |
| FORD  | 3000.00 |     20 |
+-------+---------+--------+
4 rows in set (0.00 sec)

mysql> select * from emp where hiredate in("1981-06-09");
+-------+-------+---------+------+------------+---------+------+--------+
| EMPNO | ENAME | JOB     | MGR  | HIREDATE   | SAL     | COMM | DEPTNO |
+-------+-------+---------+------+------------+---------+------+--------+
|  7782 | CLARK | MANAGER | 7839 | 1981-06-09 | 2450.00 | NULL |     10 |
+-------+-------+---------+------+------------+---------+------+--------+
1 row in set (0.04 sec)

mysql> select empno,ename,sal,comm,(comm+sal) as Total_Salary from emp;
+-------+--------+---------+---------+--------------+
| empno | ename  | sal     | comm    | Total_Salary |
+-------+--------+---------+---------+--------------+
|  7499 | ALLEN  | 1600.00 |  300.00 |      1900.00 |
|  7521 | WARD   | 1250.00 |  500.00 |      1750.00 |
|  7566 | JONES  | 2975.00 |    NULL |         NULL |
|  7654 | MARTIN | 1250.00 | 1400.00 |      2650.00 |
|  7698 | BLAKE  | 2850.00 |    NULL |         NULL |
|  7782 | CLARK  | 2450.00 |    NULL |         NULL |
|  7788 | SCOTT  | 3000.00 |    NULL |         NULL |
|  7839 | KING   | 5000.00 |    NULL |         NULL |
|  7844 | TURNER | 1500.00 |    0.00 |      1500.00 |
|  7876 | ADAMS  | 1100.00 |    NULL |         NULL |
|  7900 | JAMES  |  950.00 |    NULL |         NULL |
|  7902 | FORD   | 3000.00 |    NULL |         NULL |
|  7934 | MILLER | 1300.00 |    NULL |         NULL |
+-------+--------+---------+---------+--------------+
13 rows in set (0.00 sec)

mysql> select * from emp where sal>2000 or job in("clerk","salesman") ;
+-------+--------+-----------+------+------------+---------+---------+--------+
| EMPNO | ENAME  | JOB       | MGR  | HIREDATE   | SAL     | COMM    | DEPTNO |
+-------+--------+-----------+------+------------+---------+---------+--------+
|  7499 | ALLEN  | SALESMAN  | 7698 | 1981-02-20 | 1600.00 |  300.00 |     30 |
|  7521 | WARD   | SALESMAN  | 7698 | 1981-02-22 | 1250.00 |  500.00 |     30 |
|  7566 | JONES  | MANAGER   | 7839 | 1981-04-02 | 2975.00 |    NULL |     20 |
|  7654 | MARTIN | SALESMAN  | 7698 | 1981-09-28 | 1250.00 | 1400.00 |     30 |
|  7698 | BLAKE  | MANAGER   | 7839 | 1981-05-01 | 2850.00 |    NULL |     30 |
|  7782 | CLARK  | MANAGER   | 7839 | 1981-06-09 | 2450.00 |    NULL |     10 |
|  7788 | SCOTT  | ANALYST   | 7566 | 1982-12-09 | 3000.00 |    NULL |     20 |
|  7839 | KING   | PRESIDENT | NULL | 1981-11-17 | 5000.00 |    NULL |     10 |
|  7844 | TURNER | SALESMAN  | 7698 | 1981-09-08 | 1500.00 |    0.00 |     30 |
|  7876 | ADAMS  | CLERK     | 7788 | 1983-01-12 | 1100.00 |    NULL |     20 |
|  7900 | JAMES  | CLERK     | 7698 | 1981-12-03 |  950.00 |    NULL |     30 |
|  7902 | FORD   | ANALYST   | 7566 | 1981-12-03 | 3000.00 |    NULL |     20 |
|  7934 | MILLER | CLERK     | 7782 | 1982-01-23 | 1300.00 |    NULL |     10 |
+-------+--------+-----------+------+------------+---------+---------+--------+
13 rows in set (0.00 sec)

mysql> select * from emp where deptno in(20,30) and comm is null;
+-------+-------+---------+------+------------+---------+------+--------+
| EMPNO | ENAME | JOB     | MGR  | HIREDATE   | SAL     | COMM | DEPTNO |
+-------+-------+---------+------+------------+---------+------+--------+
|  7566 | JONES | MANAGER | 7839 | 1981-04-02 | 2975.00 | NULL |     20 |
|  7698 | BLAKE | MANAGER | 7839 | 1981-05-01 | 2850.00 | NULL |     30 |
|  7788 | SCOTT | ANALYST | 7566 | 1982-12-09 | 3000.00 | NULL |     20 |
|  7876 | ADAMS | CLERK   | 7788 | 1983-01-12 | 1100.00 | NULL |     20 |
|  7900 | JAMES | CLERK   | 7698 | 1981-12-03 |  950.00 | NULL |     30 |
|  7902 | FORD  | ANALYST | 7566 | 1981-12-03 | 3000.00 | NULL |     20 |
+-------+-------+---------+------+------------+---------+------+--------+
6 rows in set (0.00 sec)

mysql> select * from emp where deptno in(10,30) or hiredate in("1981");
ERROR 1525 (HY000): Incorrect DATE value: '1981'
mysql> select ename,empno,sal,comm,(sal+(sal*20/100)) as new Salary from emp;
ERROR 1064 (42000): You have an error in your SQL syntax; check the manual that corresponds to your MySQL server version for the right syntax to use near 'Salary from emp' at line 1
mysql> select ename,empno,sal,comm,(sal+(sal*20/100)) as newSalary from emp;
+--------+-------+---------+---------+-------------+
| ename  | empno | sal     | comm    | newSalary   |
+--------+-------+---------+---------+-------------+
| ALLEN  |  7499 | 1600.00 |  300.00 | 1920.000000 |
| WARD   |  7521 | 1250.00 |  500.00 | 1500.000000 |
| JONES  |  7566 | 2975.00 |    NULL | 3570.000000 |
| MARTIN |  7654 | 1250.00 | 1400.00 | 1500.000000 |
| BLAKE  |  7698 | 2850.00 |    NULL | 3420.000000 |
| CLARK  |  7782 | 2450.00 |    NULL | 2940.000000 |
| SCOTT  |  7788 | 3000.00 |    NULL | 3600.000000 |
| KING   |  7839 | 5000.00 |    NULL | 6000.000000 |
| TURNER |  7844 | 1500.00 |    0.00 | 1800.000000 |
| ADAMS  |  7876 | 1100.00 |    NULL | 1320.000000 |
| JAMES  |  7900 |  950.00 |    NULL | 1140.000000 |
| FORD   |  7902 | 3000.00 |    NULL | 3600.000000 |
| MILLER |  7934 | 1300.00 |    NULL | 1560.000000 |
+--------+-------+---------+---------+-------------+
13 rows in set (0.00 sec)
************************************************************************************************************************
mysql> select * from emp where deptno in(10,30) and Year(hiredate)="1981";
+-------+--------+-----------+------+------------+---------+---------+--------+
| EMPNO | ENAME  | JOB       | MGR  | HIREDATE   | SAL     | COMM    | DEPTNO |
+-------+--------+-----------+------+------------+---------+---------+--------+
|  7499 | ALLEN  | SALESMAN  | 7698 | 1981-02-20 | 1600.00 |  300.00 |     30 |
|  7521 | WARD   | SALESMAN  | 7698 | 1981-02-22 | 1250.00 |  500.00 |     30 |
|  7654 | MARTIN | SALESMAN  | 7698 | 1981-09-28 | 1250.00 | 1400.00 |     30 |
|  7698 | BLAKE  | MANAGER   | 7839 | 1981-05-01 | 2850.00 |    NULL |     30 |
|  7782 | CLARK  | MANAGER   | 7839 | 1981-06-09 | 2450.00 |    NULL |     10 |
|  7839 | KING   | PRESIDENT | NULL | 1981-11-17 | 5000.00 |    NULL |     10 |
|  7844 | TURNER | SALESMAN  | 7698 | 1981-09-08 | 1500.00 |    0.00 |     30 |
|  7900 | JAMES  | CLERK     | 7698 | 1981-12-03 |  950.00 |    NULL |     30 |
+-------+--------+-----------+------+------------+---------+---------+--------+
8 rows in set (0.03 sec)
***************************************************************************************************************************

mysql> select * from emp where Year(hiredate) between "1981" and "1982";
+-------+--------+-----------+------+------------+---------+---------+--------+
| EMPNO | ENAME  | JOB       | MGR  | HIREDATE   | SAL     | COMM    | DEPTNO |
+-------+--------+-----------+------+------------+---------+---------+--------+
|  7499 | ALLEN  | SALESMAN  | 7698 | 1981-02-20 | 1600.00 |  300.00 |     30 |
|  7521 | WARD   | SALESMAN  | 7698 | 1981-02-22 | 1250.00 |  500.00 |     30 |
|  7566 | JONES  | MANAGER   | 7839 | 1981-04-02 | 2975.00 |    NULL |     20 |
|  7654 | MARTIN | SALESMAN  | 7698 | 1981-09-28 | 1250.00 | 1400.00 |     30 |
|  7698 | BLAKE  | MANAGER   | 7839 | 1981-05-01 | 2850.00 |    NULL |     30 |
|  7782 | CLARK  | MANAGER   | 7839 | 1981-06-09 | 2450.00 |    NULL |     10 |
|  7788 | SCOTT  | ANALYST   | 7566 | 1982-12-09 | 3000.00 |    NULL |     20 |
|  7839 | KING   | PRESIDENT | NULL | 1981-11-17 | 5000.00 |    NULL |     10 |
|  7844 | TURNER | SALESMAN  | 7698 | 1981-09-08 | 1500.00 |    0.00 |     30 |
|  7900 | JAMES  | CLERK     | 7698 | 1981-12-03 |  950.00 |    NULL |     30 |
|  7902 | FORD   | ANALYST   | 7566 | 1981-12-03 | 3000.00 |    NULL |     20 |
|  7934 | MILLER | CLERK     | 7782 | 1982-01-23 | 1300.00 |    NULL |     10 |
+-------+--------+-----------+------+------------+---------+---------+--------+
12 rows in set (0.04 sec)