mysql> select * from dept;
+--------+------------+----------+
| DEPTNO | DNAME      | LOC      |
+--------+------------+----------+
|     10 | ACCOUNTING | NEW YORK |
|     20 | RESEARCH   | DALLAS   |
|     30 | SALES      | CHICAGO  |
|     40 | OPERATIONS | BOSTON   |
+--------+------------+----------+
4 rows in set (0.09 sec)

mysql> select * from salesman;
+------+----------+--------+------------+
| sid  | sname    | city   | experience |
+------+----------+--------+------------+
|   10 | Rajesh   | mumbai |          5 |
|   11 | Seema    | Pune   |          8 |
|   12 | Shailesh | Nagpur |          7 |
|   13 | Rakhi    | Pune   |          2 |
+------+----------+--------+------------+
4 rows in set (0.04 sec)

mysql> select * from customer;
+--------+--------+----------+
| custid | cname  | location |
+--------+--------+----------+
|      1 | Nilima | Pimpri   |
|      2 | Ganesh | Pune     |
|      3 | Kishor | Kothrud  |
|      5 | Geeta  | Pimpri   |
+--------+--------+----------+
4 rows in set (0.06 sec)

mysql> delete from customer where location in ("Pimpri");
Query OK, 2 rows affected (0.04 sec)

mysql> select * from customer;
+--------+--------+----------+
| custid | cname  | location |
+--------+--------+----------+
|      2 | Ganesh | Pune     |
|      3 | Kishor | Kothrud  |
+--------+--------+----------+
2 rows in set (0.00 sec)

mysql> create table customer1 as select * from customer;
Query OK, 2 rows affected (0.08 sec)
Records: 2  Duplicates: 0  Warnings: 0

mysql> select * from customer1;
+--------+--------+----------+
| custid | cname  | location |
+--------+--------+----------+
|      2 | Ganesh | Pune     |
|      3 | Kishor | Kothrud  |
+--------+--------+----------+
2 rows in set (0.00 sec)

mysql> create table salesman1 as select * from salesman;
Query OK, 4 rows affected (0.06 sec)
Records: 4  Duplicates: 0  Warnings: 0

mysql> select * from salesman1;
+------+----------+--------+------------+
| sid  | sname    | city   | experience |
+------+----------+--------+------------+
|   10 | Rajesh   | mumbai |          5 |
|   11 | Seema    | Pune   |          8 |
|   12 | Shailesh | Nagpur |          7 |
|   13 | Rakhi    | Pune   |          2 |
+------+----------+--------+------------+
4 rows in set (0.00 sec)

mysql> delete table salesman1;
ERROR 1064 (42000): You have an error in your SQL syntax; check the manual that corresponds to your MySQL server version for the right syntax to use near 'table salesman1' at line 1
mysql> delete  salesman1;
ERROR 1064 (42000): You have an error in your SQL syntax; check the manual that corresponds to your MySQL server version for the right syntax to use near '' at line 1
mysql> delete from  salesman1;
Query OK, 4 rows affected (0.05 sec)

mysql> create table emp1 as select from emp where 1=0;
ERROR 1064 (42000): You have an error in your SQL syntax; check the manual that corresponds to your MySQL server version for the right syntax to use near 'from emp where 1=0' at line 1
mysql> create table emp1 as select * from emp where 1=0;
Query OK, 0 rows affected (0.06 sec)
Records: 0  Duplicates: 0  Warnings: 0

mysql> describe emp1;
+----------+--------------+------+-----+---------+-------+
| Field    | Type         | Null | Key | Default | Extra |
+----------+--------------+------+-----+---------+-------+
| EMPNO    | int          | YES  |     | NULL    |       |
| ENAME    | varchar(15)  | YES  |     | NULL    |       |
| JOB      | varchar(9)   | YES  |     | NULL    |       |
| MGR      | int          | YES  |     | NULL    |       |
| HIREDATE | date         | YES  |     | NULL    |       |
| SAL      | decimal(7,2) | YES  |     | NULL    |       |
| COMM     | decimal(7,2) | YES  |     | NULL    |       |
| DEPTNO   | int          | YES  |     | NULL    |       |
+----------+--------------+------+-----+---------+-------+
8 rows in set (0.04 sec)

mysql> create table dept10 select * from dept;
Query OK, 4 rows affected (0.05 sec)
Records: 4  Duplicates: 0  Warnings: 0

mysql> select * from dept10;
+--------+------------+----------+
| DEPTNO | DNAME      | LOC      |
+--------+------------+----------+
|     10 | ACCOUNTING | NEW YORK |
|     20 | RESEARCH   | DALLAS   |
|     30 | SALES      | CHICAGO  |
|     40 | OPERATIONS | BOSTON   |
+--------+------------+----------+
4 rows in set (0.00 sec)

mysql> create table emp100 as select * from emp;
Query OK, 13 rows affected (0.10 sec)
Records: 13  Duplicates: 0  Warnings: 0

mysql> select * from emp100;
+-------+--------+-----------+------+------------+---------+---------+--------+
| EMPNO | ENAME  | JOB       | MGR  | HIREDATE   | SAL     | COMM    | DEPTNO |
+-------+--------+-----------+------+------------+---------+---------+--------+
|  7499 | ALLEN  | SALESMAN  | 7698 | 1981-02-20 | 1600.00 |  300.00 |     30 |
|  7521 | WARD   | SALESMAN  | 7698 | 1981-02-22 | 1250.00 |  500.00 |     30 |
|  7566 | JONES  | MANAGER   | 7839 | 1981-04-02 | 2975.00 |    NULL |     20 |
|  7654 | MARTIN | SALESMAN  | 7698 | 1981-09-28 | 1250.00 | 1400.00 |     30 |
|  7698 | BLAKE  | MANAGER   | 7839 | 1981-05-01 | 2850.00 |    NULL |     30 |
|  7782 | CLARK  | MANAGER   | 7839 | 1981-06-09 | 2450.00 |    NULL |     10 |
|  7788 | SCOTT  | ANALYST   | 7566 | 1982-12-09 | 3000.00 |    NULL |     20 |
|  7839 | KING   | PRESIDENT | NULL | 1981-11-17 | 5000.00 |    NULL |     10 |
|  7844 | TURNER | SALESMAN  | 7698 | 1981-09-08 | 1500.00 |    0.00 |     30 |
|  7876 | ADAMS  | CLERK     | 7788 | 1983-01-12 | 1100.00 |    NULL |     20 |
|  7900 | JAMES  | CLERK     | 7698 | 1981-12-03 |  950.00 |    NULL |     30 |
|  7902 | FORD   | ANALYST   | 7566 | 1981-12-03 | 3000.00 |    NULL |     20 |
|  7934 | MILLER | CLERK     | 7782 | 1982-01-23 | 1300.00 |    NULL |     10 |
+-------+--------+-----------+------+------------+---------+---------+--------+
13 rows in set (0.00 sec)

mysql> Update emp100 set sal=sal+((sal+ifnull(comm,0))*0.15) ;
Query OK, 13 rows affected (0.04 sec)
Rows matched: 13  Changed: 13  Warnings: 0

mysql> select * from emp100;
+-------+--------+-----------+------+------------+---------+---------+--------+
| EMPNO | ENAME  | JOB       | MGR  | HIREDATE   | SAL     | COMM    | DEPTNO |
+-------+--------+-----------+------+------------+---------+---------+--------+
|  7499 | ALLEN  | SALESMAN  | 7698 | 1981-02-20 | 1885.00 |  300.00 |     30 |
|  7521 | WARD   | SALESMAN  | 7698 | 1981-02-22 | 1512.50 |  500.00 |     30 |
|  7566 | JONES  | MANAGER   | 7839 | 1981-04-02 | 3421.25 |    NULL |     20 |
|  7654 | MARTIN | SALESMAN  | 7698 | 1981-09-28 | 1647.50 | 1400.00 |     30 |
|  7698 | BLAKE  | MANAGER   | 7839 | 1981-05-01 | 3277.50 |    NULL |     30 |
|  7782 | CLARK  | MANAGER   | 7839 | 1981-06-09 | 2817.50 |    NULL |     10 |
|  7788 | SCOTT  | ANALYST   | 7566 | 1982-12-09 | 3450.00 |    NULL |     20 |
|  7839 | KING   | PRESIDENT | NULL | 1981-11-17 | 5750.00 |    NULL |     10 |
|  7844 | TURNER | SALESMAN  | 7698 | 1981-09-08 | 1725.00 |    0.00 |     30 |
|  7876 | ADAMS  | CLERK     | 7788 | 1983-01-12 | 1265.00 |    NULL |     20 |
|  7900 | JAMES  | CLERK     | 7698 | 1981-12-03 | 1092.50 |    NULL |     30 |
|  7902 | FORD   | ANALYST   | 7566 | 1981-12-03 | 3450.00 |    NULL |     20 |
|  7934 | MILLER | CLERK     | 7782 | 1982-01-23 | 1495.00 |    NULL |     10 |
+-------+--------+-----------+------+------------+---------+---------+--------+
13 rows in set (0.00 sec)


  select ename,empno,comm, Case
    when comm is null then "need improvement"
                      when comm <500 then "ok"
                      when comm >=500 and comm<1000 then "good"
			else "excellent"
     end status
     from emp;
+--------+-------+---------+------------------+
| ename  | empno | comm    | status           |
+--------+-------+---------+------------------+
| ALLEN  |  7499 |  300.00 | ok               |
| WARD   |  7521 |  500.00 | good             |
| JONES  |  7566 |    NULL | need improvement |
| MARTIN |  7654 | 1400.00 | excellent        |
| BLAKE  |  7698 |    NULL | need improvement |
| CLARK  |  7782 |    NULL | need improvement |
| SCOTT  |  7788 |    NULL | need improvement |
| KING   |  7839 |    NULL | need improvement |
| TURNER |  7844 |    0.00 | ok               |
| ADAMS  |  7876 |    NULL | need improvement |
| JAMES  |  7900 |    NULL | need improvement |
| FORD   |  7902 |    NULL | need improvement |
| MILLER |  7934 |    NULL | need improvement |
+--------+-------+---------+------------------+
13 rows in set (0.00 sec)
mysql> select * from emp where regexp_like(ename,'.*r$');
+-------+--------+----------+------+------------+---------+------+--------+
| EMPNO | ENAME  | JOB      | MGR  | HIREDATE   | SAL     | COMM | DEPTNO |
+-------+--------+----------+------+------------+---------+------+--------+
|  7844 | TURNER | SALESMAN | 7698 | 1981-09-08 | 1500.00 | 0.00 |     30 |
|  7934 | MILLER | CLERK    | 7782 | 1982-01-23 | 1300.00 | NULL |     10 |
+-------+--------+----------+------+------------+---------+------+--------+
2 rows in set (0.07 sec)

mysql> select * from emp where regexp_like(ename,'^m.*r$');
+-------+--------+-------+------+------------+---------+------+--------+
| EMPNO | ENAME  | JOB   | MGR  | HIREDATE   | SAL     | COMM | DEPTNO |
+-------+--------+-------+------+------------+---------+------+--------+
|  7934 | MILLER | CLERK | 7782 | 1982-01-23 | 1300.00 | NULL |     10 |
+-------+--------+-------+------+------------+---------+------+--------+
1 row in set (0.00 sec)

mysql> select * from emp where regexp_like(ename,'^m.*|.*r$');
+-------+--------+----------+------+------------+---------+---------+--------+
| EMPNO | ENAME  | JOB      | MGR  | HIREDATE   | SAL     | COMM    | DEPTNO |
+-------+--------+----------+------+------------+---------+---------+--------+
|  7654 | MARTIN | SALESMAN | 7698 | 1981-09-28 | 1250.00 | 1400.00 |     30 |
|  7844 | TURNER | SALESMAN | 7698 | 1981-09-08 | 1500.00 |    0.00 |     30 |
|  7934 | MILLER | CLERK    | 7782 | 1982-01-23 | 1300.00 |    NULL |     10 |
+-------+--------+----------+------+------------+---------+---------+--------+
3 rows in set (0.00 sec)

mysql> select * from emp where regexp_like(ename,'_l.*');
Empty set (0.00 sec)

mysql> select * from emp where regexp_like(ename,'.l.*');
+-------+--------+----------+------+------------+---------+--------+--------+
| EMPNO | ENAME  | JOB      | MGR  | HIREDATE   | SAL     | COMM   | DEPTNO |
+-------+--------+----------+------+------------+---------+--------+--------+
|  7499 | ALLEN  | SALESMAN | 7698 | 1981-02-20 | 1600.00 | 300.00 |     30 |
|  7698 | BLAKE  | MANAGER  | 7839 | 1981-05-01 | 2850.00 |   NULL |     30 |
|  7782 | CLARK  | MANAGER  | 7839 | 1981-06-09 | 2450.00 |   NULL |     10 |
|  7934 | MILLER | CLERK    | 7782 | 1982-01-23 | 1300.00 |   NULL |     10 |
+-------+--------+----------+------+------------+---------+--------+--------+
4 rows in set (0.00 sec)

mysql> select * from emp where regexp_like(ename,'^.l.*');
+-------+-------+----------+------+------------+---------+--------+--------+
| EMPNO | ENAME | JOB      | MGR  | HIREDATE   | SAL     | COMM   | DEPTNO |
+-------+-------+----------+------+------------+---------+--------+--------+
|  7499 | ALLEN | SALESMAN | 7698 | 1981-02-20 | 1600.00 | 300.00 |     30 |
|  7698 | BLAKE | MANAGER  | 7839 | 1981-05-01 | 2850.00 |   NULL |     30 |
|  7782 | CLARK | MANAGER  | 7839 | 1981-06-09 | 2450.00 |   NULL |     10 |
+-------+-------+----------+------+------------+---------+--------+--------+
3 rows in set (0.00 sec)

mysql> select * from emp where regexp_like(ename,'^..l.*');
+-------+--------+----------+------+------------+---------+--------+--------+
| EMPNO | ENAME  | JOB      | MGR  | HIREDATE   | SAL     | COMM   | DEPTNO |
+-------+--------+----------+------+------------+---------+--------+--------+
|  7499 | ALLEN  | SALESMAN | 7698 | 1981-02-20 | 1600.00 | 300.00 |     30 |
|  7934 | MILLER | CLERK    | 7782 | 1982-01-23 | 1300.00 |   NULL |     10 |
+-------+--------+----------+------+------------+---------+--------+--------+
2 rows in set (0.00 sec)

mysql> select * from emp where regexp_like(ename,'.*es$');
+-------+-------+---------+------+------------+---------+------+--------+
| EMPNO | ENAME | JOB     | MGR  | HIREDATE   | SAL     | COMM | DEPTNO |
+-------+-------+---------+------+------------+---------+------+--------+
|  7566 | JONES | MANAGER | 7839 | 1981-04-02 | 2975.00 | NULL |     20 |
|  7900 | JAMES | CLERK   | 7698 | 1981-12-03 |  950.00 | NULL |     30 |
+-------+-------+---------+------+------------+---------+------+--------+
2 rows in set (0.00 sec)

mysql> select * from emp where regexp_like(ename,'^c.*k$');
+-------+-------+---------+------+------------+---------+------+--------+
| EMPNO | ENAME | JOB     | MGR  | HIREDATE   | SAL     | COMM | DEPTNO |
+-------+-------+---------+------+------------+---------+------+--------+
|  7782 | CLARK | MANAGER | 7839 | 1981-06-09 | 2450.00 | NULL |     10 |
+-------+-------+---------+------+------------+---------+------+--------+
1 row in set (0.00 sec)

mysql> select * from emp where regexp_like(ename,'^m|^a.*r$|e$');
+-------+--------+----------+------+------------+---------+---------+--------+
| EMPNO | ENAME  | JOB      | MGR  | HIREDATE   | SAL     | COMM    | DEPTNO |
+-------+--------+----------+------+------------+---------+---------+--------+
|  7654 | MARTIN | SALESMAN | 7698 | 1981-09-28 | 1250.00 | 1400.00 |     30 |
|  7698 | BLAKE  | MANAGER  | 7839 | 1981-05-01 | 2850.00 |    NULL |     30 |
|  7934 | MILLER | CLERK    | 7782 | 1982-01-23 | 1300.00 |    NULL |     10 |
+-------+--------+----------+------+------------+---------+---------+--------+
3 rows in set (0.00 sec)

mysql> select * from emp where regexp_like(ename,'^m.*r$|^a.*e$');
+-------+--------+-------+------+------------+---------+------+--------+
| EMPNO | ENAME  | JOB   | MGR  | HIREDATE   | SAL     | COMM | DEPTNO |
+-------+--------+-------+------+------------+---------+------+--------+
|  7934 | MILLER | CLERK | 7782 | 1982-01-23 | 1300.00 | NULL |     10 |
+-------+--------+-------+------+------------+---------+------+--------+
1 row in set (0.00 sec)

mysql> select * from emp where regexp_like(ename,'^a.*e$|^m.*e$');
Empty set (0.00 sec)

mysql> select * from emp where regexp_like(ename,'^a|^m.*e$');
+-------+-------+----------+------+------------+---------+--------+--------+
| EMPNO | ENAME | JOB      | MGR  | HIREDATE   | SAL     | COMM   | DEPTNO |
+-------+-------+----------+------+------------+---------+--------+--------+
|  7499 | ALLEN | SALESMAN | 7698 | 1981-02-20 | 1600.00 | 300.00 |     30 |
|  7876 | ADAMS | CLERK    | 7788 | 1983-01-12 | 1100.00 |   NULL |     20 |
+-------+-------+----------+------+------------+---------+--------+--------+
2 rows in set (0.00 sec)

mysql> select * from emp where regexp_like(ename,'^a.*n$|^s.*h$');
+-------+-------+----------+------+------------+---------+--------+--------+
| EMPNO | ENAME | JOB      | MGR  | HIREDATE   | SAL     | COMM   | DEPTNO |
+-------+-------+----------+------+------------+---------+--------+--------+
|  7499 | ALLEN | SALESMAN | 7698 | 1981-02-20 | 1600.00 | 300.00 |     30 |
+-------+-------+----------+------+------------+---------+--------+--------+
1 row in set (0.00 sec)

mysql> select * from emp;
+-------+--------+-----------+------+------------+---------+---------+--------+
| EMPNO | ENAME  | JOB       | MGR  | HIREDATE   | SAL     | COMM    | DEPTNO |
+-------+--------+-----------+------+------------+---------+---------+--------+
|  7499 | ALLEN  | SALESMAN  | 7698 | 1981-02-20 | 1600.00 |  300.00 |     30 |
|  7521 | WARD   | SALESMAN  | 7698 | 1981-02-22 | 1250.00 |  500.00 |     30 |
|  7566 | JONES  | MANAGER   | 7839 | 1981-04-02 | 2975.00 |    NULL |     20 |
|  7654 | MARTIN | SALESMAN  | 7698 | 1981-09-28 | 1250.00 | 1400.00 |     30 |
|  7698 | BLAKE  | MANAGER   | 7839 | 1981-05-01 | 2850.00 |    NULL |     30 |
|  7782 | CLARK  | MANAGER   | 7839 | 1981-06-09 | 2450.00 |    NULL |     10 |
|  7788 | SCOTT  | ANALYST   | 7566 | 1982-12-09 | 3000.00 |    NULL |     20 |
|  7839 | KING   | PRESIDENT | NULL | 1981-11-17 | 5000.00 |    NULL |     10 |
|  7844 | TURNER | SALESMAN  | 7698 | 1981-09-08 | 1500.00 |    0.00 |     30 |
|  7876 | ADAMS  | CLERK     | 7788 | 1983-01-12 | 1100.00 |    NULL |     20 |
|  7900 | JAMES  | CLERK     | 7698 | 1981-12-03 |  950.00 |    NULL |     30 |
|  7902 | FORD   | ANALYST   | 7566 | 1981-12-03 | 3000.00 |    NULL |     20 |
|  7934 | MILLER | CLERK     | 7782 | 1982-01-23 | 1300.00 |    NULL |     10 |
+-------+--------+-----------+------+------------+---------+---------+--------+
13 rows in set (0.00 sec)

mysql> select * from emp where regexp_like(ename,'^m.l.*r$');
+-------+--------+-------+------+------------+---------+------+--------+
| EMPNO | ENAME  | JOB   | MGR  | HIREDATE   | SAL     | COMM | DEPTNO |
+-------+--------+-------+------+------------+---------+------+--------+
|  7934 | MILLER | CLERK | 7782 | 1982-01-23 | 1300.00 | NULL |     10 |
+-------+--------+-------+------+------------+---------+------+--------+
1 row in set (0.00 sec)

mysql> select * from emp where regexp_like(ename,'..l.*r$.');
Empty set (0.00 sec)

mysql> select * from emp where regexp_like(ename,'..l.*e$.');
Empty set (0.00 sec)

mysql> select * from emp where regexp_like(ename,'..l.*e.$');
+-------+--------+----------+------+------------+---------+--------+--------+
| EMPNO | ENAME  | JOB      | MGR  | HIREDATE   | SAL     | COMM   | DEPTNO |
+-------+--------+----------+------+------------+---------+--------+--------+
|  7499 | ALLEN  | SALESMAN | 7698 | 1981-02-20 | 1600.00 | 300.00 |     30 |
|  7934 | MILLER | CLERK    | 7782 | 1982-01-23 | 1300.00 |   NULL |     10 |
+-------+--------+----------+------+------------+---------+--------+--------+
2 rows in set (0.00 sec)

mysql> select * from emp where regexp_like(ename,'?[^a|^m].*');
ERROR 3688 (HY000): Syntax error in regular expression on line 1, character 1.
mysql> select * from emp where regexp_like(ename,'?^a|?^m');
ERROR 3688 (HY000): Syntax error in regular expression on line 1, character 1.
mysql> select * from emp where regexp_like(ename,'^[^am].*');
+-------+--------+-----------+------+------------+---------+--------+--------+
| EMPNO | ENAME  | JOB       | MGR  | HIREDATE   | SAL     | COMM   | DEPTNO |
+-------+--------+-----------+------+------------+---------+--------+--------+
|  7521 | WARD   | SALESMAN  | 7698 | 1981-02-22 | 1250.00 | 500.00 |     30 |
|  7566 | JONES  | MANAGER   | 7839 | 1981-04-02 | 2975.00 |   NULL |     20 |
|  7698 | BLAKE  | MANAGER   | 7839 | 1981-05-01 | 2850.00 |   NULL |     30 |
|  7782 | CLARK  | MANAGER   | 7839 | 1981-06-09 | 2450.00 |   NULL |     10 |
|  7788 | SCOTT  | ANALYST   | 7566 | 1982-12-09 | 3000.00 |   NULL |     20 |
|  7839 | KING   | PRESIDENT | NULL | 1981-11-17 | 5000.00 |   NULL |     10 |
|  7844 | TURNER | SALESMAN  | 7698 | 1981-09-08 | 1500.00 |   0.00 |     30 |
|  7900 | JAMES  | CLERK     | 7698 | 1981-12-03 |  950.00 |   NULL |     30 |
|  7902 | FORD   | ANALYST   | 7566 | 1981-12-03 | 3000.00 |   NULL |     20 |
+-------+--------+-----------+------+------------+---------+--------+--------+
9 rows in set (0.00 sec)

mysql>  select * from emp where sal>1000 and sal <3000 and regexp_like('^a.*t$');
ERROR 1582 (42000): Incorrect parameter count in the call to native function 'regexp_like'
mysql>  select * from emp where sal>1000 and sal <3000 and regexp_like(job,'^a.*t$');
Empty set (0.00 sec)

mysql>  select * from emp where sal>1000 and sal <=3000 and regexp_like(job,'^a.*t$');
+-------+-------+---------+------+------------+---------+------+--------+
| EMPNO | ENAME | JOB     | MGR  | HIREDATE   | SAL     | COMM | DEPTNO |
+-------+-------+---------+------+------------+---------+------+--------+
|  7788 | SCOTT | ANALYST | 7566 | 1982-12-09 | 3000.00 | NULL |     20 |
|  7902 | FORD  | ANALYST | 7566 | 1981-12-03 | 3000.00 | NULL |     20 |
+-------+-------+---------+------+------------+---------+------+--------+
2 rows in set (0.00 sec)